{
  "id": "fixture-platform",
  "gate": 1,
  "name": "Fixture: a well-formed v2 room",
  "grid": [
    "####################",
    "#..................#",
    "#..G............b..#",
    "#####H##########.###",
    "#....H.............#",
    "#....H......^^.....#",
    "####################"
  ],
  "start": { "x": 1, "y": 4 },
  "periodFrames": 120,
  "jewels": [
    { "id": "jewel-1", "at": { "x": 8, "y": 1 } },
    { "id": "jewel-2", "at": { "x": 16, "y": 4 } }
  ],
  "guardians": [
    { "id": "guard-1", "route": [{ "x": 7, "y": 4 }, { "x": 8, "y": 4 }, { "x": 9, "y": 4 }, { "x": 8, "y": 4 }], "stepFrames": 10 }
  ],
  "axes": [{ "id": "axe-1", "at": { "x": 2, "y": 1 }, "uses": 2 }]
}
